{
  "$schema": "https://json-schema.org/draft/2020-12/schema",
  "$id": "https://github.com/Rynaro/eidolons-ecl/blob/v2.1.0/schemas/envelope.v2.1.json",
  "title": "ECL envelope v2.1 (Draft, adoption-gated)",
  "description": "Sidecar envelope written next to every emitted Eidolon artefact. ECL v2.1 (Draft) carries v2.0 forward and adds the optional ise.verification sub-block (§6.5.8) plus a widened envelope_version pattern accepting 2.1. v1.x and v2.0 envelopes remain valid under the §7.3 compatibility window.",
  "type": "object",
  "required": [
    "envelope_version",
    "message_id",
    "thread_id",
    "parent_id",
    "from",
    "to",
    "performative",
    "objective",
    "artifact",
    "integrity",
    "trace"
  ],
  "properties": {
    "envelope_version": {
      "type": "string",
      "pattern": "^(1\\.[012]|2\\.[01])(\\.\\d+)?$",
      "description": "ECL spec version this envelope conforms to. ECL v2.1 §1.1.1. Accepts v1.0, v1.1, v1.2, v2.0 (§7.3 compat window) and v2.1."
    },
    "message_id": {
      "type": "string",
      "format": "uuid",
      "description": "Globally unique ID. UUIDv7 RECOMMENDED."
    },
    "thread_id": {
      "type": "string",
      "format": "uuid",
      "description": "UUID grouping all envelopes of one logical mission."
    },
    "parent_id": {
      "oneOf": [
        { "type": "null" },
        { "type": "string", "format": "uuid" }
      ],
      "description": "message_id of the immediate causal predecessor. null only on the first envelope of a thread."
    },
    "from": { "$ref": "#/$defs/agentRef" },
    "to":   { "$ref": "#/$defs/agentRef" },
    "performative": {
      "$ref": "performative.v1.json#/$defs/performative",
      "description": "ECL v2.0 §2."
    },
    "edge_origin": {
      "enum": ["roster", "composition", "implicit"],
      "description": "Where the (from, to) edge is declared. ECL v2.0 §3.3."
    },
    "objective": {
      "type": "string",
      "minLength": 1,
      "maxLength": 240,
      "description": "Single sentence stating the goal of this message."
    },
    "artifact": {
      "type": "object",
      "required": ["kind", "schema_version", "path", "sha256", "size_bytes"],
      "properties": {
        "kind": {
          "type": "string",
          "pattern": "^[a-z][a-z0-9-]*$",
          "description": "Slug naming the payload kind (e.g. 'scout-report')."
        },
        "schema_version": {
          "type": "string",
          "pattern": "^\\d+\\.\\d+(\\.\\d+)?$",
          "description": "SemVer of the per-Eidolon profile schema validating this payload."
        },
        "path": {
          "type": "string",
          "pattern": "^(?!/)(?!.*\\.\\.).+$",
          "description": "Relative path. MUST NOT begin with '/' or contain '..'."
        },
        "sha256": {
          "type": "string",
          "pattern": "^[0-9a-f]{64}$",
          "description": "Lowercase hex digest of the payload bytes at emit time."
        },
        "size_bytes": {
          "type": "integer",
          "minimum": 0,
          "description": "Payload byte count at emit time."
        }
      },
      "additionalProperties": false
    },
    "context_delta": {
      "$ref": "context-delta.v1.json"
    },
    "constraints": {
      "type": "object",
      "properties": {
        "deadline_ts": {
          "oneOf": [
            { "type": "null" },
            { "type": "string", "format": "date-time" }
          ]
        },
        "trust_level": {
          "enum": ["low", "standard", "high"],
          "default": "standard"
        }
      },
      "additionalProperties": false
    },
    "ise": {
      "$ref": "#/$defs/ise",
      "description": "ISE trust-hierarchy block. OPTIONAL. ECL §6.5; gains the OPTIONAL ise.verification sub-block at v2.1 (§6.5.8)."
    },
    "expected_response": {
      "type": "object",
      "properties": {
        "performative": {
          "$ref": "performative.v1.json#/$defs/performative"
        },
        "shape_hint": {
          "type": "string",
          "description": "Free-form hint about the shape of the expected reply (e.g. 'spec.yaml + spec.md')."
        }
      },
      "additionalProperties": false
    },
    "confidence": {
      "type": "number",
      "minimum": 0,
      "maximum": 1,
      "description": "Sender's self-assessed confidence in the payload."
    },
    "assumptions": {
      "type": "array",
      "items": { "type": "string" },
      "description": "Material assumptions the receiver should know."
    },
    "integrity": {
      "type": "object",
      "required": ["method", "value"],
      "properties": {
        "method": {
          "enum": ["sha256", "hmac-sha256"],
          "description": "ECL v2.0 §6.1."
        },
        "value": {
          "type": "string",
          "pattern": "^[0-9a-f]{64}$",
          "description": "Lowercase hex digest. ECL v2.0 §6.2.1."
        }
      },
      "additionalProperties": false
    },
    "trace": {
      "type": "object",
      "required": ["ts", "host", "model", "tier"],
      "properties": {
        "ts": {
          "type": "string",
          "format": "date-time",
          "description": "RFC 3339 UTC timestamp at envelope construction."
        },
        "host": {
          "type": "string",
          "description": "Host environment slug (e.g. 'claude-code', 'cursor', 'codex', 'opencode', 'raw')."
        },
        "model": {
          "type": "string",
          "description": "Model identifier (e.g. 'claude-sonnet-4-6'). Free-form to allow vendor strings."
        },
        "tier": {
          "enum": ["standard", "trance"],
          "description": "Routing tier. ECL v2.0 §5.2."
        }
      },
      "additionalProperties": false
    }
  },
  "patternProperties": {
    "^x_[a-z][a-z0-9_]*$": {
      "description": "Vendor extension fields. Receivers SHALL ignore unknown x_* fields. ECL v2.0 §1.2.3."
    }
  },
  "additionalProperties": false,
  "$defs": {
    "agentRef": {
      "type": "object",
      "required": ["eidolon", "version"],
      "properties": {
        "eidolon": {
          "type": "string",
          "pattern": "^[a-z][a-z0-9-]*$",
          "description": "Lowercase slug. Reserved values: 'human', 'orchestrator'."
        },
        "version": {
          "type": "string",
          "pattern": "^\\d+\\.\\d+\\.\\d+$|^n/a$",
          "description": "SemVer of the Eidolon, or the literal 'n/a' for 'human' / 'orchestrator'."
        }
      },
      "additionalProperties": false
    },
    "ise": {
      "type": "object",
      "additionalProperties": false,
      "required": ["assertion_grade"],
      "properties": {
        "assertion_grade": {
          "type": "string",
          "enum": ["unverified", "self-attested", "validated", "human-reviewed"],
          "description": "Emitter's claim about how the artefact was produced. 'unverified' = emitted without internal checks; 'self-attested' = emitter ran its own validation; 'validated' = emitter ran spec-mandated gates; 'human-reviewed' = operator signed off."
        },
        "provenance": {
          "type": "object",
          "additionalProperties": false,
          "required": ["methodology_version"],
          "properties": {
            "methodology_version": {
              "type": "string",
              "pattern": "^[a-z][a-z0-9-]*-\\d+\\.\\d+\\.\\d+$",
              "description": "Eidolon methodology + semver, e.g. 'spectra-4.3.1', 'atlas-1.5.1'."
            },
            "tool_surface": {
              "type": "array",
              "items": { "type": "string" },
              "maxItems": 32,
              "description": "Distinct tool primitives invoked during artefact production (e.g. 'read','grep','bash')."
            },
            "lateral_consults": {
              "type": "array",
              "items": {
                "type": "object",
                "required": ["eidolon", "performative"],
                "properties": {
                  "eidolon": { "type": "string" },
                  "performative": { "type": "string", "enum": ["INFORM","REQUEST","QUERY","INFORM-RESULT","INFORM-FAILURE","COMMIT","REJECT","ACK","CANCEL","SUBSCRIBE"] }
                }
              },
              "maxItems": 8,
              "description": "Inline-recorded sibling-Eidolon consults that informed this artefact."
            }
          }
        },
        "receiver_authorization": {
          "type": "object",
          "additionalProperties": false,
          "properties": {
            "auto_route":  { "type": "boolean", "default": true,  "description": "Receiver MAY hand the envelope to the next contracted edge without operator confirm." },
            "auto_merge":  { "type": "boolean", "default": false, "description": "Receiver MAY merge the artefact into a mainline branch without operator confirm." },
            "auto_deploy": { "type": "boolean", "default": false, "description": "Receiver MAY deploy/publish without operator confirm." }
          }
        },
        "verification": {
          "type": "object",
          "additionalProperties": false,
          "required": ["fresh_context", "checker", "transcript_access"],
          "description": "ECL v2.1 verify-attestation seam (§6.5.8). OPTIONAL; when present its shape is MUST (gate S-4). ECL only shape-checks it — the MUST-level pairing with assertion_grade='validated' is owned by ESL (C8).",
          "properties": {
            "fresh_context": {
              "type": "boolean",
              "description": "true iff the checker verified the artefact from a context that did not include the emitter's generating transcript."
            },
            "checker": {
              "type": "string",
              "pattern": "^[a-z][a-z0-9-]*$",
              "description": "Slug of the Eidolon (or reserved 'human'/'orchestrator') that performed the verification. Same slug pattern as from.eidolon/to.eidolon (§1.1.3). SHOULD differ from from.eidolon (§6.5.8.2)."
            },
            "transcript_access": {
              "type": "string",
              "enum": ["none", "artifact-only"],
              "description": "Checker's access at verification time. 'none' = neither transcript nor payload text seen ahead of verification; 'artifact-only' = only the emitted payload artefact read. Any other value is rejected (S-4)."
            }
          }
        }
      }
    }
  }
}
