{
  "envelope_version": "2.0",
  "message_id": "01942c7f-4d5e-7e04-9c5d-5gh4ebF6h0d5",
  "thread_id": "4042b976-63b7-4bc8-bbcf-15205a8e0ffd",
  "parent_id": "cf492a47-a1ee-4622-ba33-d16a0514cfe9",
  "from": {
    "eidolon": "atlas",
    "version": "1.4.2"
  },
  "to": {
    "eidolon": "spectra",
    "version": "4.2.11"
  },
  "performative": "PROPOSE",
  "edge_origin": "roster",
  "objective": "Hand off scout-report (v2.0 with ISE) for install.sh dead-code cleanup spec authoring.",
  "artifact": {
    "kind": "scout-report",
    "schema_version": "2.0",
    "path": "scout-report.md",
    "sha256": "0883c61ab45d1b5b10f45574f0f56ccf9cc237d7e5558c2427d2e0acfaa326cb",
    "size_bytes": 1511
  },
  "context_delta": {
    "token_budget": 4000,
    "tokens_used": 380,
    "input_handles": [],
    "summary": "Four findings on install.sh dead code; one gap (Cursor wiring trace) deferred. Scope bounded to install.sh."
  },
  "constraints": {
    "trust_level": "standard"
  },
  "ise": {
    "assertion_grade": "self-attested",
    "provenance": {
      "methodology_version": "atlas-1.4.2",
      "tool_surface": ["Read", "Bash"]
    },
    "receiver_authorization": {
      "auto_route": true,
      "auto_merge": false,
      "auto_deploy": false
    }
  },
  "confidence": 0.92,
  "integrity": {
    "method": "sha256",
    "value": "0883c61ab45d1b5b10f45574f0f56ccf9cc237d7e5558c2427d2e0acfaa326cb"
  },
  "trace": {
    "ts": "2026-05-13T10:00:00Z",
    "host": "claude-code",
    "model": "claude-sonnet-4-6",
    "tier": "standard"
  }
}
